id,name,power,accuracy,pp,type_id,effect_chance,damage_class,effect,flavor_text
439,Rock Wrecker,150,90,5,6,,1,"Inflicts regular damage.  User loses its next turn to ""recharge"", and cannot attack or switch out during that turn.","The user launches a huge boulder at the foe to attack. It must rest on the next turn, however."
144,Transform,,,10,1,,3,"User copies the target’s species, weight, type, ability, calculated stats (except HP), and moves.  Copied moves will all have 5 PP remaining.  IVs are copied for the purposes of hidden power, but stats are not recalculated.  choice band, choice scarf, and choice specs stay in effect, and the user must select a new move.  This move cannot be copied by mirror move, nor forced by encore.",The user assumes the foe's guise.
775,Clangorous Soul,,100,5,16,100,3,,The user raises all its stats by using some of its HP.
111,Defense Curl,,,40,1,,3,"Raises user’s Defense by one stage.  After this move is used, the power of ice ball and rollout are doubled until the user leaves the field.",Heightens the user's DEFENSE.
501,Quick Guard,,,15,2,,3,"Moves with priority greater than 0 will not hit friendly Pokémon for the remainder of this turn.  If the user is last to act this turn, this move will fail.  This move cannot be selected by assist or metronome.","The user protects itself and its allies from priority moves. If used in succession, its chance of failing rises."
211,Steel Wing,70,90,25,9,10,1,Inflicts regular damage. Has a 10% chance to raise the user’s Defense one stage.,Stiff wings strike the foe.
82,Dragon Rage,,100,10,16,,2,Inflicts exactly 40 damage.,Always inflicts 40HP damage.
278,Recycle,,,10,1,,3,"User recovers the last item consumed by the user or a Pokémon in its position on the field.  The item must be used again before it can be recovered by this move again.  If the user is holding an item, this move fails.  Items taken or given away by covet, knock off, switcheroo, thief, or trick may not be recovered.",Recycles a used item for one more use.
479,Smack Down,50,100,15,6,100,1,"Inflicts regular damage.  Removes the target’s immunity to ground-type damage.  This effect removes any existing Ground immunity due to levitate, magnet rise, or telekinesis, and causes the target’s flying type to be ignored when it takes Ground damage.  If the target isn’t immune to Ground damage, this move will fail.  This move can hit Pokémon under the effect of bounce, fly, or sky drop, and ends the effect of Bounce or Fly.",The user throws a stone or projectile to attack an opponent. A flying Pokémon will fall to the ground when hit.
857,Jet Punch,60,100,15,11,,1,,The user summons a torrent around its fist and punches at blinding speed. This move always goes first.
185,Feint Attack,60,,20,17,,1,Inflicts regular damage.  Ignores accuracy and evasion modifiers.,An attack that never misses.
577,Draining Kiss,50,100,10,18,,2,Deals regular damage.  Drains 75% of the damage inflicted to heal the user.,The user steals the target’s energy with a kiss. The user’s HP is restored by over half of the damage taken by the target.
583,Play Rough,90,90,10,18,10,1,Inflicts regular damage.  Has a $effect_chance% chance to lower the target’s Attack by one stage.,The user plays rough with the target and attacks it. This may also lower the target’s Attack stat.
166,Sketch,,,1,1,,3,"Permanently replaces itself with the target’s last used move.  If that move is chatter or struggle, this move will fail.  This move cannot be copied by mimic or mirror move, nor selected by assist or metronome, nor forced by encore.",Copies the foe's move permanently.
180,Spite,,100,10,8,,3,"Lowers the PP of the target’s last used move by 4.  If the target hasn’t used a move since entering the field, if it tried to use a move this turn and failed, or if its last used move has 0 PP remaining, this move will fail.",Cuts the PP of the foe's last move.
242,Crunch,80,100,15,17,20,1,Inflicts regular damage.  Has a $effect_chance% chance to lower the target’s Defense by one stage.,An attack that may lower SPCL.DEF.
705,Fleur Cannon,130,90,5,18,100,2,"Inflicts regular damage, then lowers the user’s Special Attack by two stages.",The user unleashes a strong beam. The attack’s recoil harshly lowers the user’s Sp. Atk stat.
491,Acid Spray,40,100,20,4,100,2,Inflicts regular damage.  Lowers the target’s Special Defense by two stages.,The user spits fluid that works to melt the target. This harshly reduces the target’s Sp. Def stat.
168,Thief,60,100,25,17,,1,"Inflicts regular damage.  If the target is holding an item and the user is not, the user will permanently take the item.  Damage is still inflicted if an item cannot be taken.  Pokémon with sticky hold or multitype are immune to the item theft effect.  The target cannot recover its item with recycle.  This move cannot be selected by assist or metronome.","While attacking, it may steal the foe’s held item."
860,Population Bomb,20,90,10,1,,1,,The user’s fellows gather in droves to perform a combo attack that hits the target one to ten times in a row.
540,Psystrike,100,100,10,14,,2,"Inflicts regular damage.  Damage calculation always uses the target’s Defense, regardless of this move’s damage class.",The user materializes an odd psychic wave to attack the target. This attack does physical damage.
48,Supersonic,,55,20,1,,3,Confuses the target.,Sound waves that cause confusion.
146,Dizzy Punch,70,100,10,1,20,1,Inflicts regular damage.  Has a $effect_chance% chance to confuse the target.,An attack that may cause confusion.
916,Supercell Slam,100,95,15,13,,1,,"The user electrifies its body and drops onto the target to inflict damage. If this move misses, the user takes damage instead."
568,Noble Roar,,100,30,1,100,3,Lowers the target’s Attack and Special Attack by one stage.,"Letting out a noble roar, the user intimidates the target and lowers its Attack and Sp. Atk stats."
202,Giga Drain,75,100,10,12,,2,Inflicts regular damage.  Drains half the damage inflicted to heal the user.,Steals 1/2 of the damage inflicted.
346,Water Sport,,,15,11,,3,"fire moves inflict half damage, regardless of target.  If the user leaves the field, this effect ends.",The user becomes soaked to raise resistance to fire.
309,Meteor Mash,90,90,10,9,20,1,Inflicts regular damage. Has a $effect_chance% chance to raise the user’s Attack one stage.,Fires a meteor-like punch. May raise ATTACK.
383,Copycat,,,20,1,,3,"Uses the last move that was used successfully by any Pokémon, including the user.  This move cannot copy itself, nor roar nor whirlwind.  This move cannot be copied by mirror move, nor selected by assist, metronome, or sleep talk.",The user mimics the move used immediately before it. The move fails if no other move has been used yet.
200,Outrage,120,100,10,16,,1,"Inflicts regular damage.  User is forced to attack with this move for 2–3 turns,selected at random.  After the last hit, the user becomes confused.  safeguard does not protect against the confusion from this move.",Works 2-3 turns and confuses user.
810,Corrosive Gas,,100,40,4,,3,Inflicts regular damage.,The user surrounds everything around it with highly acidic gas and melts away items they hold.
885,Trailblaze,50,100,20,12,,1,,The user attacks suddenly as if leaping out from tall grass. The user's nimble footwork boosts its Speed stat.
855,Lumina Crash,80,100,10,14,,2,,The user attacks by unleashing a peculiar light that even affects the mind. This also harshly lowers the target's Sp. Def stat.
58,Ice Beam,90,100,10,15,10,2,Inflicts regular damage.  Has a $effect_chance% chance to freeze the target.,An attack that may freeze the foe.
61,Bubble Beam,65,100,20,11,10,2,Inflicts regular damage.  Has a $effect_chance% chance to lower the target’s Speed by one stage.,An attack that may lower SPEED.
545,Searing Shot,100,100,5,10,30,2,Inflicts regular damage.  Has a $effect_chance% chance to burn the target.,An inferno of scarlet flames torches everything around the user. It may leave targets with a burn.
34,Body Slam,85,100,15,1,30,1,Inflicts regular damage.  Has a $effect_chance% chance to paralyze the target.,An attack that may cause paralysis.
187,Belly Drum,,,10,1,,3,"User pays half its max HP to raise its Attack to +6 stages.  If the user cannot pay the HP cost, this move will fail.",Reduces own HP to maximize ATTACK.
496,Round,60,100,15,1,,2,"Inflicts regular damage.  If round has already been used this turn, this move’s power is doubled.  After this move is used, any other Pokémon using it this turn will immediately do so (in the order they would otherwise act), regardless of Speed or priority.  Pokémon using other moves will then continue to act as usual.",The user attacks the target with a song. Others can join in the Round and make the attack do greater damage.
851,Tera Blast,80,100,10,1,,2,,"If the user has Terastallized, it unleashes energy of its Tera Type. This move inflicts damage using the Attack or Sp. Atk stat—whichever is higher for the user."
389,Sucker Punch,70,100,5,17,,1,"Inflicts regular damage.  If the target has not selected a damaging move this turn, or if the target has already acted this turn, this move will fail.  This move is not affected by iron fist.","This move enables the user to attack first. It fails if the foe is not readying an attack, however."
155,Bonemerang,50,90,10,5,,1,Inflicts regular damage.  Hits twice in one turn.,An attack that strikes twice.
393,Magnet Rise,,,10,13,,3,"For five turns, the user is immune to ground moves.  If the user is under the effect of ingrain or has levitate, this move will fail.  This effect is temporarily disabled by and cannot be used during gravity.  This effect is passed on by baton pass.",The user levitates using electrically generated magnetism for five turns.
495,After You,,,15,1,,3,"The target will act next this turn, regardless of Speed or move priority. If the target has already acted this turn, this move will fail.",The user helps the target and makes it use its move right after the user.
348,Leaf Blade,90,100,15,12,,1,Inflicts regular damage.  User’s critical hit rate is one level higher when using this move.,Slashes with a sharp leaf. High critical-hit ratio.
131,Spike Cannon,20,100,15,1,,1,"Inflicts regular damage.  Hits 2–5 times in one turn.  Has a 3/8 chance each to hit 2 or 3 times, and a 1/8 chance each to hit 4 or 5 times.  Averages to 3 hits per use.",Fires spikes to hit 2-5 times.
616,Lands Wrath,90,100,10,5,,1,Inflicts regular damage.,The user gathers the energy of the land and focuses that power on opposing Pokémon to damage them.
194,Destiny Bond,,,5,8,,3,"If the user faints before its next move, the Pokémon that fainted it will automatically faint.  End-of-turn damage is ignored.  This move cannot be selected by assist or metronome.",The foe faints if the user does.
609,Nuzzle,20,100,20,13,100,1,Inflicts regular damage.  Has a $effect_chance% chance to paralyze the target.,The user attacks by nuzzling its electrified cheeks against the target. This also leaves the target with paralysis.
78,Stun Spore,,75,30,12,,3,Paralyzes the target.,A move that may paralyze the foe.
411,Focus Blast,120,70,5,2,10,2,Inflicts regular damage.  Has a $effect_chance% chance to lower the target’s Special Defense by one stage.,The user heightens its mental focus and unleashes its power. It may also lower the target’s Sp. Def.
84,Thunder Shock,40,100,30,13,10,2,Inflicts regular damage.  Has a $effect_chance% chance to paralyze the target.,An electrical attack that may paralyze the foe.
163,Slash,70,100,20,1,,1,Inflicts regular damage.  User’s critical hit rate is one level higher when using this move.,Has a high criti­ cal hit ratio.
270,Helping Hand,,,20,1,,3,"Boosts the power of the target’s moves by 50% until the end of this turn.  This move cannot be copied by mirror move, nor selected by assist or metronome.",A move that boosts the power of the ally’s attack in a Double Battle.
139,Poison Gas,,90,40,4,,3,Poisons the target.,A move that may poison the foe.
425,Shadow Sneak,40,100,30,8,,1,Inflicts regular damage.,The user extends its shadow and attacks the foe from behind. This move always goes first.
59,Blizzard,110,70,5,15,10,2,"Inflicts regular damage.  Has a $effect_chance% chance to freeze the target.  During hail, this move has 100% accuracy.  It also has a (100 - accuracy)% chance to break through the protection of protect and detect.",An attack that may freeze the foe.
129,Swift,60,,20,1,,2,Inflicts regular damage.  Ignores accuracy and evasion modifiers.,Sprays star-shaped rays that never miss.
355,Roost,,,5,3,,3,"Heals the user for half its max HP.  If the user is flying, its flying type is ignored until the end of this turn.",The user lands and rests its body. It restores the user’s HP by up to half of its max HP.
259,Torment,,100,15,17,,3,"Prevents the target from attempting to use the same move twice in a row.  When the target leaves the field, this effect ends.  If the target is forced to attempt a repeated move due to choice band, choice scarf, choice specs, disable, encore, taunt, only having PP remaining for one move, or any other effect, the target will use struggle instead.  The target is then free to use the forced move next turn, as it didn’t use that move this turn.",Torments the foe and stops successive use of a move.
160,Conversion,,,30,1,,3,"User’s type changes to the type of one of its moves, selected at random.  hidden power and weather ball are treated as normal.  Only moves with a different type are eligible, and curse is never eligible.  If the user has no suitable moves, this move will fail.",Change user's type to a move's type.
391,Heart Swap,,,10,14,,3,User swaps its stat modifiers with the target.,The user employs its psychic power to switch stat changes with the foe.
535,Heat Crash,,100,10,10,,1,"Inflicts regular damage.  The greater the user’s weight compared to the target’s, the higher power this move has, to a maximum of 120.  User’s weight                    | Power -------------------------------- | ----: Up to 2× the target’s weight     |    40 Up to 3× the target’s weight     |    60 Up to 4× the target’s weight     |    80 Up to 5× the target’s weight     |   100 More than 5× the target’s weight |   120 ","The user slams its target with its flame- covered body. The more the user outweighs the target, the greater the damage."
714,Moongeist Beam,100,100,5,8,,2,"Inflicts regular damage.  Other Pokémon’s abilities cannot activate in response to this move.  In particular, it hits through disguise",The user emits a sinister ray to attack the target. This move can be used on the target regardless of  its Abilities.
570,Parabolic Charge,65,100,20,13,,2,Heals the user for half the total damage dealt to all targets.,The user attacks everything around it. The user’s HP is restored by half the damage taken by those hit.
405,Bug Buzz,90,100,10,7,10,2,Inflicts regular damage.  Has a $effect_chance% chance to lower the target’s Special Defense by one stage.,The user vibrates its wings to generate a damaging sound wave. It may also lower the foe’s Sp. Def stat.
875,Psyblade,80,100,15,14,,1,,The user rends the target with an ethereal blade. This move's power is boosted by 50 percent if the user is on Electric Terrain.
223,Dynamic Punch,100,50,5,2,100,1,Inflicts regular damage.  Has a $effect_chance% chance to confuse the target.,An attack that always confuses.
227,Encore,,100,5,1,,3,"The next 4–8 times (selected at random) the target attempts to move, it is forced to repeat its last used move.  If the selected move allows the trainer to select a target, an opponent will be selected at random each turn.  If the target is prevented from using the selected move by some other effect, struggle will be used instead.  This effect ends if the selected move runs out of PP.  If the target hasn’t used a move since entering the field, if it tried to use a move this turn and failed, if it does not know the selected move, or if the selected move has 0 PP remaining, this move will fail.  If the target’s last used move was encore, mimic, mirror move, sketch, struggle, or transform, this move will fail.",Makes the foe re­ peat 2-6 times.
797,Expanding Force,80,100,10,14,,2,Inflicts regular damage.,The user attacks the target with its psychic power. This move’s power goes up and damages all opposing Pokémon on Psychic Terrain.
551,Blue Flare,130,85,5,10,20,2,Inflicts regular damage.  Has a $effect_chance% chance to burn the target.,"The user attacks by engulfing the target in an intense, yet beautiful, blue flame. It may leave the target with a burn."
73,Leech Seed,,90,10,12,,3,Plants a seed on the target that drains 1/8 of its max HP at the end of every turn and heals the user for the amount taken.  Has no effect on grass Pokémon.  The seed remains until the target leaves the field.  The user takes damage instead of being healed if the target has liquid ooze.  rapid spin will remove this effect.  This effect is passed on by baton pass.,Steals HP from the foe on every turn.
182,Protect,,,10,1,,3,"No moves will hit the user for the remainder of this turn.  If the user is last to act this turn, this move will fail.  If the user successfully used detect, endure, protect, quick guard, or wide guard on the last turn, this move has a 50% chance to fail.  lock on, mind reader, and no guard provide a (100 – accuracy)% chance for moves to break through this move.  This does not apply to one-hit KO moves (fissure, guillotine, horn drill, and sheer cold); those are always blocked by this move.  thunder during rain dance and blizzard during hail have a 30% chance to break through this move.  The following effects are not prevented by this move:  * acupressure from an ally * curse’s curse effect * Delayed damage from doom desire and future sight; however, these moves will be prevented if they are used this turn * feint, which will also end this move’s protection after it hits * imprison * perish song * shadow force * Moves that merely copy the user, such as transform or psych up  This move cannot be selected by assist or metronome.",Foils attack that turn. It may fail.
324,Signal Beam,75,100,15,7,10,2,Inflicts regular damage.  Has a $effect_chance% chance to confuse the target.,A strange beam attack that may confuse the foe.
529,Drill Run,80,95,10,5,,1,Inflicts regular damage.  User’s critical hit rate is one level higher when using this move.,The user crashes into its target while rotating its body like a drill. Critical hits land more easily.
454,Attack Order,90,100,15,7,,1,Inflicts regular damage.  User’s critical hit rate is one level higher when using this move.,The user calls out its underlings to pummel the target. Critical hits land more easily.
574,Disarming Voice,40,,15,18,,2,Inflicts regular damage.  Ignores accuracy and evasion.,"Letting out a charming cry, the user does emotional damage to opposing Pokémon. This attack never misses."
693,Brutal Swing,60,100,20,17,,1,Inflicts regular damage.,The user swings its body around violently to inflict damage on everything in its vicinity.
902,Matcha Gotcha,80,90,15,12,,2,,The user fires a blast of tea that it mixed. The user's HP is restored by up to half the damage taken by the target. This may also leave the target with a burn.
880,Shed Tail,0,,10,1,,3,,The user creates a substitute for itself using its own HP before switching places with a party Pokémon in waiting.
254,Stockpile,,,20,1,,3,"Raises the user’s Defense and Special Defense by one stage each.  Stores energy for use with spit up and swallow.  Up to three levels of energy can be stored, and all are lost if the user leaves the field.  Energy is still stored even if the stat boosts cannot be applied.  If the user uses baton pass, the stat boosts are passed as normal, but the stored energy is not.",Charges up power for up to 3 turns.
170,Mind Reader,,,5,1,,3,"If the user targets the same target again before the end of the next turn, the move it uses is guaranteed to hit.  This move itself also ignores accuracy and evasion modifiers.  One-hit KO moves are also guaranteed to hit, as long as the user is equal or higher level than the target.  This effect also allows the user to hit Pokémon that are off the field due to moves such as dig or fly.  If the target uses detect or protect while under the effect of this move, the user is not guaranteed to hit, but has a (100 - accuracy)% chance to break through the protection.  This effect is passed on by baton pass.",Ensures the next attack will hit.
515,Final Gambit,,100,5,2,,2,Inflicts damage equal to the user’s remaining HP.  User faints.,The user risks everything to attack its target. The user faints but does damage equal to the user’s HP.
448,Chatter,65,100,20,3,100,2,"Inflicts regular damage.  Has either a 1%, 11%, or 31% chance to confuse the target, based on the volume of the recording made for this move; louder recordings increase the chance of confusion.  If the user is not a chatot, this move will not cause confusion.  This move cannot be copied by mimic, mirror move, or sketch, nor selected by assist, metronome, or sleep talk.",The user attacks using a sound wave based on words it has learned. It may also confuse the foe.
455,Defend Order,,,10,7,,3,Raises the user’s Defense and Special Defense by one stage.,"The user calls out its underlings to make a living shield, raising its Defense and Sp. Def stats."
881,Chilly Reception,0,,10,15,,3,,The user tells a chillingly bad joke before switching places with a party Pokémon in waiting. This summons a snowstorm lasting five turns.
682,Burn Up,130,100,5,10,,2,"Inflicts regular damage.  Removes the user’s fire type after damage calculation.  If the user is not fire-type, this move will fail.","To inflict massive damage, the user burns itself out. After using this move, the user will no longer be Fire type."
594,Water Shuriken,15,100,20,11,,2,Inflicts regular damage.  Hits 2–5 times.,The user hits the target with throwing stars two to five times in a row. This move always goes first.
381,Lucky Chant,,,30,1,,3,"For five turns, opposing Pokémon cannot score critical hits.","The user chants an incantation toward the sky, preventing the foe from landing critical hits."
422,Thunder Fang,65,95,15,13,10,1,Inflicts regular damage.  Has a $effect_chance% chance to paralyze the target and a separate $effect_chance% chance to make the target flinch.,The user bites with electrified fangs. It may also make the foe flinch or become paralyzed.
154,Fury Swipes,18,80,15,1,,1,"Inflicts regular damage.  Hits 2–5 times in one turn.  Has a 3/8 chance each to hit 2 or 3 times, and a 1/8 chance each to hit 4 or 5 times.  Averages to 3 hits per use.",Quickly scratches 2-5 times.
222,Magnitude,,100,30,5,,1,"Inflicts regular damage.  Power is selected at random between 10 and 150, with an average of 71:  Magnitude | Power | Chance --------: | ----: | -----:         4 |    10 |     5%         5 |    30 |    10%         6 |    50 |    20%         7 |    70 |    30%         8 |    90 |    20%         9 |   110 |    10%        10 |   150 |     5%  This move has double power against Pokémon currently underground due to dig.",A ground attack with random power.
512,Acrobatics,55,100,15,3,,1,"Inflicts regular damage.  If the user has no held item, this move has double power.","The user nimbly strikes the target. If the user is not holding an item, this attack inflicts massive damage."
582,Electrify,,,20,13,,3,Changes the target’s move’s type to electric if it hasn’t moved yet this turn.,"If the target is electrified before it uses a move during that turn, the target’s move becomes Electric type."
417,Nasty Plot,,,20,17,,3,Raises the user’s Special Attack by two stages.,The user stimulates its brain by thinking bad thoughts. It sharply raises the user’s Sp. Atk.
816,Jungle Healing,,,10,12,,3,Inflicts regular damage.,"The user becomes one with the jungle, restoring HP and healing any status conditions of itself and its ally Pokémon in battle."
10,Scratch,40,100,35,1,,1,Inflicts regular damage.,Scratches with sharp claws.
834,Wave Crash,120,100,10,11,,1,,The user shrouds itself in water and slams into the target with its whole body to inflict damage. This also damages the user and raises the user’s action speed.
354,Psycho Boost,140,90,5,14,100,2,"Inflicts regular damage, then lowers the user’s Special Attack by two stages.","Allows a full-power attack, but sharply lowers SP. ATK."
575,Parting Shot,,100,20,17,100,3,Lowers all targets’ Attack and Special Attack by one stage.  Makes the user switch out.,"With a parting threat, the user lowers the target’s Attack and Sp. Atk stats. Then it switches with a party Pokémon."
673,Laser Focus,,,30,1,,3,The user’s next move will result in a critical hit.,The user concentrates intensely. The attack on the next turn always results in a critical hit.
333,Icicle Spear,25,100,30,15,,1,"Inflicts regular damage.  Hits 2–5 times in one turn.  Has a 3/8 chance each to hit 2 or 3 times, and a 1/8 chance each to hit 4 or 5 times.  Averages to 3 hits per use.",Attacks the foe by firing 2 to 5 icicles in a row.
366,Tailwind,,,15,3,,3,"For the next three turns, all Pokémon on the user’s side of the field have their original Speed doubled.  This effect remains if the user leaves the field.",The user whips up a turbulent whirlwind that ups the Speed of all party Pokémon for three turns.
38,Double Edge,120,100,15,1,,1,Inflicts regular damage.  User takes 1/3 the damage it inflicts in recoil.,A tackle that also hurts the user.
