pokedex_number,name,hp,attack,defense,sp_attack,sp_defense,speed,height,weight,flavor_text
331,Cacnea,50,85,40,85,40,35,0.4,51.3,"CACNEA lives in arid locations such as deserts. It releases a strong aroma from its flower to attract prey. When prey comes near, this POKéMON shoots sharp thorns from its body to bring the victim down."
332,Cacturne,70,115,60,115,60,55,1.3,77.4,"During the daytime, CACTURNE remains unmoving so that it does not lose any moisture to the harsh desert sun. This POKéMON becomes active at night when the temperature drops."
333,Swablu,45,40,60,40,75,50,0.4,1.2,SWABLU has light and fluffy wings that are like cottony clouds. This POKéMON is not frightened of people. It lands on the heads of people and sits there like a cotton-fluff hat.
334,Altaria,75,70,90,70,105,80,1.1,20.6,"ALTARIA dances and wheels through the sky among billowing, cotton-like clouds. By singing melodies in its crystal-clear voice, this POKéMON makes its listeners experience dreamy wonderment."
335,Zangoose,73,115,60,60,60,90,1.3,40.3,Memories of battling its arch-rival SEVIPER are etched into every cell of ZANGOOSE’s body. This POKéMON adroitly dodges attacks with incredible agility.
336,Seviper,73,100,60,100,60,65,2.7,52.5,SEVIPER shares a generations-long feud with ZANGOOSE. The scars on its body are evidence of vicious battles. This POKéMON attacks using its sword- edged tail.
337,Lunatone,90,55,65,95,85,70,1.0,168.0,"LUNATONE was discovered at a location where a meteorite fell. As a result, some people theorize that this POKéMON came from space. However, no one has been able to prove this theory so far."
338,Solrock,90,95,85,55,65,70,1.2,154.0,"Solar energy is the source of its power, so it is strong during the daytime. When it spins, its body shines."
339,Barboach,50,48,43,46,41,60,0.4,1.9,"BARBOACH’s sensitive whiskers serve as a superb radar system. This POKéMON hides in mud, leaving only its two whiskers exposed while it waits for prey to come along."
340,Whiscash,110,78,73,76,71,60,0.9,23.6,"WHISCASH is extremely territorial. Just one of these POKéMON will claim a large pond as its exclusive territory. If a foe approaches it, it thrashes about and triggers a massive earthquake."
341,Corphish,43,80,65,50,35,35,0.6,11.5,Its hardy vitality enables it to adapt to any environment. Its pincers will never release prey.
342,Crawdaunt,63,120,85,90,55,55,1.1,32.8,"CRAWDAUNT has an extremely violent nature that compels it to challenge other living things to battle. Other life-forms refuse to live in ponds inhabited by this POKéMON, making them desolate places."
343,Baltoy,40,40,55,40,70,55,0.5,21.5,BALTOY moves while spinning around on its one foot. Primitive wall paintings depicting this POKéMON living among people were discovered in some ancient ruins.
344,Claydol,60,70,105,70,120,75,1.5,108.0,CLAYDOL are said to be dolls of mud made by primitive humans and brought to life by exposure to a mysterious ray. This POKéMON moves about while levitating.
345,Lileep,66,41,77,61,87,23,1.0,23.8,LILEEP became extinct approximately a hundred million years ago. This ancient POKéMON attaches itself to a rock on the seafloor and catches approaching prey using tentacles  shaped like flower petals.
346,Cradily,86,81,97,81,107,43,1.5,60.4,CRADILY roams around the ocean floor in search of food. This POKéMON freely extends its tree trunk-like neck and captures unwary prey using its eight tentacles.
347,Anorith,45,95,50,40,50,75,0.7,12.5,ANORITH was regenerated from a prehistoric fossil. This primitive POKéMON once lived in warm seas. It grips its prey firmly between its two large claws.
348,Armaldo,75,125,100,70,80,45,1.5,68.2,ARMALDO’s tough armor makes all attacks bounce off. This POKéMON’s two enormous claws can be freely extended or contracted. They have the power to punch right through a steel slab.
349,Feebas,20,15,20,10,55,80,0.6,7.4,"FEEBAS’s fins are ragged and tattered from the start of its life. Because of its shoddy appearance, this POKéMON is largely ignored. It is capable of living in both the sea and in rivers."
350,Milotic,95,60,79,100,125,81,6.2,162.0,Its lovely scales are described as rainbow colored. They change color depending on the viewing angle.
351,Castform,70,70,70,70,70,70,0.3,0.8,CASTFORM’s appearance changes with the weather. This POKéMON gained the ability to use the vast power of nature to protect its tiny body.
352,Kecleon,60,90,70,60,120,40,1.0,22.0,It changes body color to blend in with its surroundings. It also changes color if it is happy or sad.
353,Shuppet,44,75,35,63,33,45,0.6,2.3,"SHUPPET is attracted by feelings of jealousy and vindictiveness. If someone develops strong feelings of vengeance, this POKéMON will appear in a swarm and line up beneath the eaves of that person’s home."
354,Banette,64,115,65,83,63,65,1.1,12.5,BANETTE generates energy for laying strong curses by sticking pins into its own body. This POKéMON was originally a pitiful plush doll that was thrown away.
355,Duskull,20,40,90,30,90,25,0.8,15.0,"DUSKULL can pass through any wall no matter how thick it may be. Once this POKéMON chooses a target, it will doggedly pursue the intended victim until the break of dawn."
356,Dusclops,40,70,130,60,130,25,1.6,30.6,"DUSCLOPS’s body is completely hollow - there is nothing at all inside. It is said that its body is like a black hole. This POKéMON will absorb anything into its body, but nothing will ever come back out."
357,Tropius,99,68,83,72,87,51,2.0,100.0,"The bunches of fruit around TROPIUS’s neck are very popular with children. This POKéMON loves fruit, and eats it continuously. Apparently, its love for fruit resulted in its own outgrowth of fruit."
358,Chimecho,75,50,80,95,90,65,0.6,1.0,"CHIMECHO makes its cries echo inside its hollow body. When this POKéMON becomes enraged, its cries result in ultrasonic waves that have the power to knock foes flying."
359,Absol,65,130,60,75,60,75,1.2,47.0,"Every time ABSOL appears before people, it is followed by a disaster such as an earthquake or a tidal wave. As a result, it came to be known as the disaster POKéMON."
360,Wynaut,95,23,48,23,48,23,0.6,14.0,"WYNAUT can always be seen with a big, happy smile on its face. Look at its tail to determine if it is angry. When angered, this POKéMON will be slapping the ground with its tail."
361,Snorunt,50,50,50,50,50,50,0.7,16.8,"SNORUNT live in regions with heavy snowfall. In seasons without snow, such as spring and summer, this POKéMON steals away to live quietly among stalactites and stalagmites deep in caverns."
362,Glalie,80,80,80,80,80,80,1.5,256.5,"GLALIE has a body made of rock, which it hardens with an armor of ice. This POKéMON has the ability to freeze moisture in the atmosphere into any shape it desires."
363,Spheal,70,40,50,55,50,25,0.8,39.5,"SPHEAL is much faster rolling than  walking to get around. When groups of this POKéMON eat, they all clap at once to show their pleasure. Because of this, their mealtimes are noisy."
364,Sealeo,90,60,70,75,70,45,1.1,87.6,SEALEO has the habit of always juggling on the tip of its nose anything it sees for the first time. This POKéMON occasionally entertains itself by balancing and rolling a SPHEAL on its nose.
365,Walrein,110,80,90,95,90,65,1.4,150.6,It swims through icy seas while shattering ice floes with its large tusks. It is protected by its thick blubber.
366,Clamperl,35,64,85,74,55,32,0.4,52.5,CLAMPERL’s sturdy shell is not only good for protection - it is also used for clamping and catching prey. A fully grown CLAMPERL’s shell will be scored with nicks and scratches all over.
367,Huntail,55,104,105,94,75,52,1.7,27.0,HUNTAIL’s presence went unnoticed by people for a long time because it lives at extreme depths in the sea. This POKéMON’s eyes can see clearly even in the murky dark depths of the ocean.
368,Gorebyss,55,84,105,114,75,52,1.8,22.6,"GOREBYSS lives in the southern seas at extreme depths. Its body is built to withstand the enormous pressure of water at incredible depths. Because of this, this POKéMON’s body is unharmed by ordinary attacks."
369,Relicanth,100,90,130,45,65,55,1.0,23.4,RELICANTH is a POKéMON species that existed for a hundred million years without ever changing its form. This ancient POKéMON feeds on microscopic organisms with its toothless mouth.
370,Luvdisc,43,30,55,40,65,97,0.6,8.7,LUVDISC live in shallow seas in the tropics. This heart-shaped POKéMON earned its name by swimming after loving couples it spotted in the ocean’s waves.
371,Bagon,45,75,60,40,30,50,0.6,42.1,"Dreaming of one day flying, it practices by leaping off cliffs every day."
372,Shelgon,65,95,100,60,50,50,1.1,110.5,"Inside SHELGON’s armor-like shell, cells are in the midst of transformation to create an entirely new body. This POKéMON’s shell is extremely heavy, making its movements sluggish."
373,Salamence,95,135,80,110,80,100,1.5,102.6,"SALAMENCE came about as a result of a strong, long-held dream of growing wings. It is said that this powerful desire triggered a sudden mutation in this POKéMON’s cells, causing it to sprout its magnificent wings."
374,Beldum,40,55,80,35,60,30,0.6,95.2,"Instead of blood, a powerful magnetic force courses throughout BELDUM’s body. This POKéMON communicates with others by sending controlled pulses of magnetism."
375,Metang,60,75,100,55,80,50,1.2,202.5,"When two BELDUM fuse together, METANG is formed. The brains of the BELDUM are joined by a magnetic nervous system. By linking its brains magnetically, this POKéMON generates strong psychokinetic power."
376,Metagross,80,135,130,95,90,70,1.6,550.0,"METAGROSS has four brains in total. Combined, the four brains can breeze through difficult calculations faster than a supercomputer. This POKéMON can float in the air by tucking in its four legs."
377,Regirock,80,100,200,50,100,50,1.7,230.0,"Its entire body is made of rock. If any part chips off in battle, it attaches rocks to repair itself."
378,Regice,80,50,100,100,200,50,1.8,175.0,"REGICE’s body was made during an ice age. The deep-frozen body can’t be melted, even by fire. This POKéMON controls frigid air of minus 328 degrees F."
379,Registeel,80,75,150,75,150,50,1.9,205.0,REGISTEEL has a body that is harder than any kind of metal. Its body is apparently hollow. No one has any idea what this POKéMON eats.
380,Latias,80,80,90,110,130,110,1.4,40.0,"LATIAS is highly sensitive to the emotions of people. If it senses any hostility, this POKéMON ruffles the feathers all over its body and cries shrilly to intimidate the foe."
381,Latios,80,90,80,130,110,110,2.0,60.0,LATIOS has the ability to make its foe see an image of what it has seen or imagines in its head. This POKéMON is intelligent and understands human speech.
382,Kyogre,100,100,90,150,140,90,4.5,352.0,KYOGRE has the power to create massive rain clouds that cover the entire sky and bring about torrential downpours. This POKéMON saved people who were suffering from droughts.
383,Groudon,100,150,140,100,90,90,3.5,950.0,GROUDON has long been described in  mythology as the POKéMON that raised lands and expanded continents. This POKéMON took to sleep after a cataclysmic battle with KYOGRE.
384,Rayquaza,105,150,90,150,90,95,7.0,206.5,"RAYQUAZA lived for hundreds of millions of years in the earth’s ozone layer,  never descending to the ground. This POKéMON appears to feed on water and particles in the atmosphere."
385,Jirachi,100,100,100,100,100,100,0.3,1.1,"A legend states that JIRACHI will make true any wish that is written on notes attached to its head when it awakens. If this POKéMON senses danger, it will fight without awakening."
386,Deoxys,50,150,50,150,50,150,1.7,60.8,The DNA of a space virus underwent a sudden mutation upon exposure to a laser beam and resulted in DEOXYS. The crystalline organ on this POKéMON’s chest appears to be its brain.
387,Turtwig,55,68,64,45,55,31,0.4,10.2,"Made from soil, the shell on its back hardens when it drinks water. It lives along lakes."
388,Grotle,75,89,85,55,65,36,1.1,97.0,It knows where pure water wells up. It carries fellow Pokémon there on its back.
389,Torterra,95,109,105,75,85,56,2.2,310.0,Small Pokémon occasionally gather on its unmoving back to begin building their nests.
390,Chimchar,44,58,44,58,44,61,0.5,6.2,It agilely scales sheer cliffs to live atop craggy mountains. Its fire is put out when it sleeps.
391,Monferno,64,78,52,78,52,81,0.9,22.0,"To intimidate attackers, it stretches the fire on its tail to make itself appear bigger."
392,Infernape,76,104,71,104,71,108,1.2,55.0,It uses a special kind of martial arts involving all its limbs. Its fire never goes out.
393,Piplup,53,51,53,61,56,40,0.4,5.2,"Because it is very proud, it hates accepting food from people. Its thick down guards it from cold."
394,Prinplup,64,66,68,81,76,50,0.8,23.0,"It lives alone, away from others. Apparently, every one of them believes it is the most important."
395,Empoleon,84,86,88,111,101,60,1.7,84.5,The three horns that extend from its beak attest to its power. The leader has the biggest horns.
396,Starly,40,55,30,30,30,60,0.3,2.0,"They flock in great numbers. Though small, they flap their wings with great power."
397,Staravia,55,75,50,40,40,80,0.6,15.5,It flies around forests and fields in search of bug Pokémon. It stays within a huge flock.
398,Staraptor,85,120,70,50,60,100,1.2,24.9,It has a savage nature. It will courageously challenge foes that are much larger.
399,Bidoof,59,45,40,35,40,31,0.5,20.0,"With nerves of steel, nothing can perturb it. It is more agile and active than it appears."
400,Bibarel,79,85,60,55,60,71,1.0,31.5,It makes its nest by damming streams with bark and mud. It is known as an industrious worker.
401,Kricketot,37,25,41,25,41,25,0.3,2.2,"It shakes its head back to front, causing its antennae to hit each other and sound like a xylophone."
402,Kricketune,77,85,51,55,51,65,1.0,25.5,It crosses its knifelike arms in front of its chest when it cries. It can compose melodies ad lib.
403,Shinx,45,65,34,40,34,45,0.5,9.5,All of its fur dazzles if danger is sensed. It flees while the foe is momentarily blinded.
404,Luxio,60,85,49,60,49,60,0.9,30.5,Its claws loose electricity with enough amperage to cause fainting. They live in small groups.
405,Luxray,80,120,79,95,79,70,1.4,42.0,It has eyes that can see through anything. It spots and captures prey hiding behind objects.
406,Budew,40,30,35,50,70,55,0.2,1.2,"Over the winter, it closes its bud and endures the cold. In spring, the bud opens and releases pollen."
407,Roserade,60,70,65,125,105,90,0.9,14.5,"It attracts prey with a sweet aroma, then downs it with thorny whips hidden in its arms."
408,Cranidos,67,125,40,30,30,58,0.9,31.5,It lived in jungles around 100 million years ago. Its skull is as hard as iron.
409,Rampardos,97,165,60,65,50,58,1.6,102.5,Its powerful head butt has enough power to shatter even the most durable things upon impact.
410,Shieldon,30,42,118,42,88,30,0.5,57.0,A Pokémon that lived in jungles around 100 million years ago. Its facial hide is extremely hard.
411,Bastiodon,60,52,168,47,138,30,1.3,149.5,Any frontal attack is repulsed. It is a docile Pokémon that feeds on grass and berries.
412,Burmy,40,29,45,29,45,36,0.2,3.4,"To shelter itself from cold, wintry winds, it covers itself with a cloak made of twigs and leaves."
413,Wormadam,60,59,85,79,105,36,0.5,6.5,"When BURMY evolved, its cloak became a part of this Pokémon’s body. The cloak is never shed."
414,Mothim,70,94,50,94,50,66,0.9,23.3,It loves the honey of flowers and steals honey collected by COMBEE.
415,Combee,30,30,42,30,42,70,0.3,5.5,A Pokémon formed by three others. It busily carries sweet floral honey to VESPIQUEN.
416,Vespiquen,70,80,102,80,102,40,1.2,38.5,Its abdomen is a honeycomb for grubs. It raises its grubs on honey collected by COMBEE.
417,Pachirisu,60,45,70,45,90,95,0.4,3.9,It makes fur balls that crackle with static electricity. It stores them with berries in tree holes.
418,Buizel,55,65,35,60,30,85,0.7,29.5,It has a flotation sac that is like an inflatable collar. It floats on water with its head out.
419,Floatzel,85,105,55,85,50,115,1.1,33.5,It floats using its well-developed flotation sac. It assists in the rescues of drowning people.
420,Cherubi,45,35,45,62,53,35,0.4,3.3,"The small ball holds the nutrients needed for evolution. Apparently, it is very sweet and tasty."
421,Cherrim,70,60,70,87,78,85,0.5,9.3,It blooms during times of strong sunlight. It tries to make up for everything it endured as a bud.
422,Shellos,76,48,48,57,62,34,0.3,6.3,"Its colors and shapes differ from region to region. In the Sinnoh region, two types are confirmed."
423,Gastrodon,111,83,68,92,82,39,0.9,29.9,"It has a pliable body without any bones. If any part of its body is torn off, it grows right back."
424,Ambipom,75,100,66,60,66,115,1.2,20.3,"To eat, it deftly shucks nuts with its two tails. It rarely uses its arms now."
425,Drifloon,90,50,34,60,44,70,0.4,1.2,"A Pokémon formed by the spirits of people and Pokémon. It loves damp, humid seasons."
426,Drifblim,150,80,44,90,54,80,1.2,15.0,"At dusk, swarms of them are carried aloft on winds. When noticed, they suddenly vanish."
427,Buneary,55,66,44,44,56,85,0.4,5.5,It slams foes by sharply uncoiling its rolled ears. It stings enough to make a grown-up cry in pain.
428,Lopunny,65,76,84,54,96,105,1.2,33.3,An extremely cautious Pokémon. It cloaks its body with its fluffy ear fur when it senses danger.
429,Mismagius,60,60,60,105,105,105,0.9,4.4,Its cries sound like incantations. Those hearing it are tormented by headaches and hallucinations.
430,Honchkrow,100,125,52,105,52,71,0.9,27.3,"Becoming active at night, it is known to swarm with numerous MURKROW in tow."
431,Glameow,49,55,42,42,37,85,0.5,3.9,It claws if displeased and purrs when affectionate. Its fickleness is very popular among some.
432,Purugly,71,82,64,64,59,112,1.0,43.8,It is a brazen brute that barges its way into another Pokémon’s nest and claims it as its own.
433,Chingling,45,30,50,65,50,45,0.2,0.6,It emits cries by agitating an orb at the back of its throat. It moves with flouncing hops.
434,Stunky,63,63,47,41,41,74,0.4,19.2,It protects itself by spraying a noxious fluid from its rear. The stench lingers for 24 hours.
435,Skuntank,103,93,67,71,61,84,1.0,38.0,It sprays a vile-smelling fluid from the tip of its tail to attack. Its range is over 160 feet.
436,Bronzor,57,24,86,24,86,23,0.5,60.5,Implements shaped like it were discovered in ancient tombs. It is unknown if they are related.
437,Bronzong,67,89,116,79,116,33,1.3,187.0,"One caused a news sensation when it was dug up at a construction site after a 2,000-year sleep."
438,Bonsly,50,80,95,10,45,10,0.5,15.0,It looks as if it is always crying. It is actually adjusting its body’s fluid levels by eliminating excess.
439,Mime Jr,20,25,45,70,90,60,0.6,13.0,"It habitually mimics foes. Once mimicked, the foe cannot take its eyes off this Pokémon."
440,Happiny,100,5,5,15,65,30,0.6,24.4,It loves round white things. It carries an egg-shaped rock in imitation of CHANSEY.
441,Chatot,76,65,45,92,42,91,0.5,1.9,"It can learn and speak human words. If they gather, they all learn the same saying."
442,Spiritomb,50,92,108,92,108,35,1.0,108.0,A Pokémon that was formed by 108 spirits. It is bound to a fissure in an odd keystone.
443,Gible,58,70,45,40,45,42,0.7,20.5,"It nests in small, horizontal holes in cave walls. It pounces to catch prey that stray too close."
444,Gabite,68,90,65,50,55,82,1.4,56.0,There is a long-held belief that medicine made from its scales will heal even incurable illnesses.
445,Garchomp,108,130,95,80,85,102,1.9,95.0,"When it folds up its body and extends its wings, it looks like a jet plane. It flies at sonic speed."
446,Munchlax,135,85,40,40,85,5,0.6,105.0,"It wolfs down its weight in food once a day, swallowing food whole with almost no chewing."
447,Riolu,40,70,40,35,40,60,0.7,20.2,The aura that emanates from its body intensifies to alert others if it is afraid or sad.
448,Lucario,70,110,70,115,70,90,1.2,54.0,It has the ability to sense the auras of all things. It understands human speech.
449,Hippopotas,68,72,78,38,42,32,0.8,49.5,"It lives in arid places. Instead of perspiration, it expels grainy sand from its body."
450,Hippowdon,108,112,118,68,72,47,2.0,300.0,It blasts internally stored sand from ports on its body to create a towering twister for attack.
451,Skorupi,40,50,90,30,55,65,0.8,12.0,It grips prey with its tail claws and injects poison. It tenaciously hangs on until the poison takes.
452,Drapion,70,90,110,60,75,95,1.3,61.5,It has the power in its clawed arms to make scrap of a car. The tips of its claws release poison.
453,Croagunk,48,61,40,61,40,50,0.7,23.0,Its cheeks hold poison sacs. It tries to catch foes off guard to jab them with toxic fingers.
454,Toxicroak,83,106,65,86,65,85,1.3,44.4,Its knuckle claws secrete a toxin so vile that even a scratch could prove fatal.
455,Carnivine,74,100,72,90,72,46,1.4,27.0,"It attracts prey with its sweet- smelling saliva, then chomps down. It takes a whole day to eat prey."
456,Finneon,49,49,56,49,61,66,0.4,7.0,"After long exposure to sunlight, the patterns on its tail fins shine vividly when darkness arrives."
457,Lumineon,69,69,76,69,86,91,1.2,24.0,It lives on the deep-sea floor. It attracts prey by flashing the patterns on its four tail fins.
458,Mantyke,45,20,50,60,120,50,1.0,65.0,A friendly Pokémon that captures the subtle flows of seawater using its two antennae.
459,Snover,60,62,50,62,60,40,1.0,50.5,"It lives on snowy mountains. Having had little contact with humans, it is boldly inquisitive."
460,Abomasnow,90,92,75,92,85,60,2.2,135.5,It whips up blizzards in mountains that are always buried in snow. It is the abominable snowman.
461,Weavile,70,120,65,45,85,125,1.1,34.0,"They live in cold regions, forming groups of four or five that hunt prey with impressive coordination."
462,Magnezone,70,70,115,130,90,60,1.2,180.0,It evolved from exposure to a special magnetic field. Three units generate magnetism.
463,Lickilicky,110,85,95,80,95,50,1.7,140.0,It wraps things with its extensible tongue. Getting too close to it will leave you soaked with drool.
464,Rhyperior,115,140,130,55,55,40,2.4,282.8,It puts rocks in holes in its palms and uses its muscles to shoot them. GEODUDE are shot at rare times.
465,Tangrowth,100,100,125,110,50,50,2.0,128.6,It ensnares prey by extending arms made of vines. Losing arms to predators does not trouble it.
466,Electivire,75,123,67,95,85,95,1.8,138.6,"As its electric charge amplifies, blue sparks begin to crackle between its horns."
467,Magmortar,75,95,67,125,95,83,1.6,68.0,"It blasts fireballs of over 3,600 degrees F from the ends of its arms. It lives in volcanic craters."
468,Togekiss,85,50,95,120,115,80,1.5,38.0,It will never appear where there is strife. Its sightings have become rare recently.
469,Yanmega,86,76,86,116,56,95,1.9,51.5,"By churning its wings, it creates shock waves that inflict critical internal injuries to foes."
470,Leafeon,65,110,130,60,65,95,1.0,25.5,"Just like a plant, it uses photosynthesis. As a result, it is always enveloped in clear air."
471,Glaceon,65,60,110,130,95,65,0.8,25.9,"As a protective technique, it can completely freeze its fur to make its hairs stand like needles."
472,Gliscor,75,95,125,45,75,95,2.0,42.5,"It observes prey while hanging inverted from branches. When the chance presents itself, it swoops!"
473,Mamoswine,110,130,80,70,60,80,2.5,291.0,Its impressive tusks are made of ice. The population thinned when it turned warm after the ice age.
474,Porygon Z,85,80,70,135,75,90,0.9,34.0,"Additional software was installed to make it a better Pokémon. It began acting oddly, however."
475,Gallade,68,125,65,65,115,80,1.6,52.0,"A master of courtesy and swordsmanship, it fights using extending swords on its elbows."
476,Probopass,60,55,145,75,150,40,1.4,340.0,It freely controls three small units called Mini-Noses using magnetic force.
477,Dusknoir,45,100,135,65,135,45,2.2,106.6,The antenna on its head captures radio waves from the world of spirits that command it to take people there.
478,Froslass,70,80,70,80,70,110,1.3,26.6,It freezes foes with an icy breath nearly -60 degrees F. What seems to be its body is actually hollow.
479,Rotom,50,50,77,95,77,91,0.3,0.3,Its body is composed of plasma. It is known to infiltrate electronic devices and wreak havoc.
480,Uxie,75,75,130,75,130,95,0.3,0.3,Known as “The Being of Knowledge.” It is said that it can wipe out the memory of those who see its eyes.
481,Mesprit,80,105,105,105,105,80,0.3,0.3,"Known as “The Being of Emotion.” It taught humans the nobility of sorrow, pain, and joy."
482,Azelf,75,125,70,125,70,115,0.3,0.3,Known as “The Being of Willpower.” It sleeps at the bottom of a lake to keep the world in balance.
483,Dialga,100,120,120,150,100,90,5.4,683.0,It has the power to control time. It appears in Sinnoh-region myths as an ancient deity.
484,Palkia,90,120,100,150,120,100,4.2,336.0,It has the ability to distort space. It is described as a deity in Sinnoh-region mythology.
485,Heatran,91,90,106,130,106,77,1.7,430.0,It dwells in volcanic caves. It digs in with its cross-shaped feet to crawl on ceilings and walls.
486,Regigigas,110,160,110,80,110,100,3.7,420.0,There is an enduring legend that states this Pokémon towed continents with ropes.
487,Giratina,150,100,120,100,120,90,4.5,750.0,A Pokémon that is said to live in a world on the reverse side of ours. It appears in an ancient cemetery.
488,Cresselia,120,70,110,75,120,85,1.5,85.6,Shiny particles are released from its wings like a veil. It is said to represent the crescent moon.
489,Phione,80,80,80,80,80,80,0.4,3.1,"It drifts in warm seas. It always returns to where it was born, no matter how far it may have drifted."
490,Manaphy,100,100,100,100,100,100,0.3,1.4,"Born on a cold seafloor, it will swim great distances to return to its birthplace."
