pokedex_number,name,hp,attack,defense,sp_attack,sp_defense,speed,height,weight,flavor_text
491,Darkrai,70,90,90,135,90,125,1.5,50.5,It can lull people to sleep and make them dream. It is active during nights of the new moon.
492,Shaymin,100,100,100,100,100,100,0.2,2.1,It lives in flower patches and avoids detection by curling up to look like a flowering plant.
493,Arceus,120,120,120,120,120,120,3.2,320.0,"It is described in mythology as the Pokémon that shaped the universe with its 1,000 arms."
494,Victini,100,100,100,100,100,100,0.4,4.0,"This Pokémon brings victory. It is said that Trainers with Victini always win, regardless of the type of encounter."
495,Snivy,45,45,55,45,55,63,0.6,8.1,It is very intelligent and calm. Being exposed to lots of sunlight makes its movements swifter.
496,Servine,60,60,75,60,75,83,0.8,16.0,"It moves along the ground as if sliding. Its swift movements befuddle its foes, and it then attacks with a vine whip."
497,Serperior,75,75,95,75,95,113,3.3,63.0,It can stop its opponents’ movements with just a glare. It takes in solar energy and boosts it internally.
498,Tepig,65,63,45,45,45,45,0.5,9.9,It can deftly dodge its foe’s attacks while shooting fireballs from its nose. It roasts berries before it eats them.
499,Pignite,90,93,55,70,55,55,1.0,55.5,"When its internal fire flares up, its movements grow sharper and faster. When in trouble, it emits smoke."
500,Emboar,110,123,65,100,65,65,1.6,150.0,It can throw a fire punch by setting its fists on fire with its fiery chin. It cares deeply about its friends.
501,Oshawott,55,55,45,63,45,45,0.5,5.9,"It fights using the scalchop on its stomach. In response to an attack, it retaliates immediately by slashing."
502,Dewott,75,75,60,83,60,60,0.8,24.5,Strict training is how it learns its flowing double-scalchop technique.
503,Samurott,95,100,85,108,70,70,1.5,94.6,One swing of the sword incorporated in its armor can fell an opponent. A simple glare from one of them quiets everybody.
504,Patrat,45,55,39,35,39,42,0.5,11.6,"Using food stored in cheek pouches, they can keep watch for days. They use their tails to communicate with others."
505,Watchog,60,85,69,60,69,77,1.1,27.0,"When they see an enemy, their tails stand high, and they spit the seeds of berries stored in their cheek pouches."
506,Lillipup,45,60,45,25,45,55,0.4,4.1,"It faces strong opponents with great courage. But, when at a disadvantage in a fight, this intelligent Pokémon flees."
507,Herdier,65,80,65,35,65,60,0.9,14.7,"It has black, cape-like fur that is very hard and decreases the amount of damage it receives."
508,Stoutland,85,110,90,45,90,80,1.2,61.0,It rescues people stranded by blizzards in the mountains. Its shaggy fur shields it from the cold.
509,Purrloin,41,50,37,50,37,66,0.4,10.1,"They steal from people for fun, but their victims can’t help but forgive them. Their deceptively cute act is perfect."
510,Liepard,64,88,50,88,50,106,1.1,37.5,These Pokémon vanish and appear unexpectedly. Many Trainers are drawn to their beautiful form and fur.
511,Pansage,50,53,48,53,48,64,0.6,10.5,This Pokémon dwells deep in the forest. Eating a leaf from its head whisks weariness away as if by magic.
512,Simisage,75,98,63,98,63,101,1.1,30.5,"Ill tempered, it fights by swinging its barbed tail around wildly. The leaf growing on its head is very bitter."
513,Pansear,50,53,48,53,48,64,0.6,11.0,"When it is angered, the temperature of its head tuft reaches 600° F. It uses its tuft to roast berries."
514,Simisear,75,98,63,98,63,101,1.0,28.0,It loves sweets because they become energy for the fire burning inside its body.
515,Panpour,50,53,48,53,48,64,0.6,13.5,The water stored inside the tuft on its head is full of nutrients. Plants that receive its water grow large.
516,Simipour,75,98,63,98,63,101,1.0,29.0,"The tuft on its head holds water. When the level runs low, it replenishes the tuft by siphoning up water with its tail."
517,Munna,76,25,45,67,55,24,0.6,23.3,Munna always float in the air. People whose dreams are eaten by them forget what the dreams had been about.
518,Musharna,116,55,85,107,95,29,1.1,60.5,The mist emanating from their foreheads is packed with the dreams of people and Pokémon.
519,Pidove,50,55,50,36,30,43,0.3,2.1,"Each follows its Trainer’s orders as best it can, but they sometimes fail to understand complicated commands."
520,Tranquill,62,77,62,50,42,65,0.6,15.0,It can return to its Trainer’s location regardless of the distance separating them.
521,Unfezant,80,115,80,65,55,93,1.2,29.0,Males swing their head plumage to threaten opponents. The females’ flying abilities surpass those of the males.
522,Blitzle,45,60,32,50,32,76,0.8,29.8,"When thunderclouds cover the sky, it will appear. It can catch lightning with its mane and store the electricity."
523,Zebstrika,75,100,63,80,63,116,1.6,79.5,"They have lightning-like movements. When Zebstrika run at full speed, the sound of thunder reverberates."
524,Roggenrola,55,75,85,25,25,15,0.4,18.0,"Its ear is hexagonal in shape. Compressed underground, its body is as hard as steel."
525,Boldore,70,105,105,50,40,20,0.9,102.0,"When it overflows with power, the orange crystal on its body glows. It looks for underground water in caves."
526,Gigalith,85,135,130,60,80,25,1.7,260.0,Compressing the energy from its internal core lets it fire off an attack capable of blowing away a mountain.
527,Woobat,65,45,43,55,43,72,0.4,2.1,Its habitat is dark forests and caves. It emits ultrasonic waves from its nose to learn about its surroundings.
528,Swoobat,67,57,55,77,55,114,0.9,10.5,"It emits sound waves of various frequencies from its nose, including some powerful enough to destroy rocks."
529,Drilbur,60,85,40,30,45,68,0.3,8.5,It can dig through the ground at a speed of 30 mph. It could give a car running aboveground a good race.
530,Excadrill,110,135,60,50,65,88,0.7,40.4,It can help in tunnel construction. Its drill has evolved into steel strong enough to bore through iron plates.
531,Audino,103,60,86,60,86,50,1.1,31.0,"It touches others with the feelers on its ears, using the sound of their heartbeats to tell how they are feeling."
532,Timburr,75,80,55,25,35,35,0.6,12.5,It fights by swinging a piece of lumber around. It is close to evolving when it can handle the lumber without difficulty.
533,Gurdurr,85,105,85,40,50,40,1.2,40.0,This Pokémon is so muscular and strongly built that even a group of wrestlers could not make it budge an inch.
534,Conkeldurr,105,140,95,55,65,45,1.4,87.0,"It is thought that Conkeldurr taught humans how to make concrete more than 2,000 years ago."
535,Tympole,50,50,40,50,40,64,0.5,4.5,They warn others of danger by vibrating their cheeks to create a high-pitched sound.
536,Palpitoad,75,65,55,65,55,69,0.8,17.0,"When they vibrate the bumps on their heads, they can make waves in water or earthquake-like vibrations on land."
537,Seismitoad,105,95,75,85,75,74,1.5,62.0,They shoot paralyzing liquid from their head bumps. They use vibration to hurt their opponents.
538,Throh,120,100,85,30,85,45,1.3,55.5,"When it tightens its belt, it becomes stronger. Wild Throh use vines to weave their own belts."
539,Sawk,75,125,75,30,75,85,1.4,51.0,The sound of Sawk punching boulders and trees can be heard all the way from the mountains where they train.
540,Sewaddle,45,53,70,40,60,42,0.3,2.5,Leavanny dress it in clothes they made for it when it hatched. It hides its head in its hood while it is sleeping.
541,Swadloon,55,63,90,50,80,42,0.5,7.3,Forests where Swadloon live have superb foliage because the nutrients they make from fallen leaves nourish the plant life.
542,Leavanny,75,103,80,70,80,92,1.2,20.5,"Upon finding a small Pokémon, it weaves clothing for it from leaves, using the cutters on its arms and sticky silk."
543,Venipede,30,45,59,30,39,57,0.4,5.3,"Its bite injects a potent poison, enough to paralyze large bird Pokémon that try to prey on it."
544,Whirlipede,40,55,99,40,79,47,1.2,58.5,"Protected by a hard shell, it spins its body like a wheel and crashes furiously into its enemies."
545,Scolipede,60,100,89,55,69,112,2.5,200.5,"With quick movements, it chases down its foes, attacking relentlessly with its horns until it prevails."
546,Cottonee,40,27,60,37,50,66,0.3,0.6,"When attacked, it escapes by shooting cotton from its body. The cotton serves as a decoy to distract the attacker."
547,Whimsicott,60,67,85,77,75,116,0.7,6.6,"Like the wind, it can slip through any gap, no matter how small. It leaves balls of white fluff behind."
548,Petilil,45,35,50,70,50,30,0.5,6.6,The leaves on its head are very bitter. Eating one of these leaves is known to refresh a tired body.
549,Lilligant,70,60,75,110,75,90,1.1,16.3,Even veteran Trainers face a challenge in getting its beautiful flower to bloom. This Pokémon is popular with celebrities.
550,Basculin,70,92,65,80,55,98,1.0,18.0,"Red and blue Basculin get along so poorly, they’ll start fighting instantly. These Pokémon are very hostile."
551,Sandile,50,72,35,35,35,65,0.7,15.2,They live buried in the sands of the desert. The sun-warmed sands prevent their body temperature from dropping.
552,Krokorok,60,82,45,45,45,74,1.0,33.4,They live in groups of a few individuals. Protective membranes shield their eyes from sandstorms.
553,Krookodile,95,117,80,65,70,92,1.5,96.3,"They never allow prey to escape. Their jaws are so powerful, they can crush the body of an automobile."
554,Darumaka,70,90,45,15,45,50,0.6,37.5,"When its internal fire is burning, it cannot calm down and it runs around. When the fire diminishes, it falls asleep."
555,Darmanitan,105,140,55,30,55,95,1.3,92.9,"Its internal fire burns at 2,500° F, making enough power that it can destroy a dump truck with one punch."
556,Maractus,75,86,67,106,67,60,1.0,28.0,It uses an up-tempo song and dance to drive away the bird Pokémon that prey on its flower seeds.
557,Dwebble,50,65,85,35,35,55,0.3,14.5,This Pokémon can easily melt holes in hard rocks with a liquid secreted from its mouth.
558,Crustle,70,105,125,65,75,45,1.4,200.0,"Competing for territory, Crustle fight viciously. The one whose boulder is broken is the loser of the battle."
559,Scraggy,50,75,70,35,70,48,0.6,11.8,"Its skin has a rubbery elasticity, so it can reduce damage by defensively pulling its skin up to its neck."
560,Scrafty,65,90,115,45,115,58,1.1,30.0,Groups of them beat up anything that enters their territory. Each can spit acidic liquid from its mouth.
561,Sigilyph,72,58,80,103,80,97,1.4,14.0,"They never vary the route they fly, because their memories of guarding an ancient city remain steadfast."
562,Yamask,38,30,85,55,65,30,0.5,1.5,Each of them carries a mask that used to be its face when it was human. Sometimes they look at it and cry.
563,Cofagrigus,58,50,145,95,105,30,1.7,76.5,It has been said that they swallow those who get too close and turn them into mummies. They like to eat gold nuggets.
564,Tirtouga,54,78,103,53,45,22,0.7,16.5,"Restored from a fossil, this Pokémon can dive to depths beyond half a mile."
565,Carracosta,74,108,133,83,65,32,1.2,81.0,They can live both in the ocean and on land. A slap from one of them is enough to open a hole in the bottom of a tanker.
566,Archen,55,112,45,74,45,70,0.5,9.5,"Said to be an ancestor of bird Pokémon, they were unable to fly and moved about by hopping from one branch to another."
567,Archeops,75,140,65,112,65,110,1.4,32.0,"They are intelligent and will cooperate to catch prey. From the ground, they use a running start to take flight."
568,Trubbish,50,50,62,40,62,65,0.6,31.0,Inhaling the gas they belch will make you sleep for a week. They prefer unsanitary places.
569,Garbodor,80,95,82,60,82,75,1.9,107.3,It clenches opponents with its left arm and finishes them off with foul-smelling poison gas belched from its mouth.
570,Zorua,40,65,40,80,40,65,0.7,12.5,"It changes into the forms of others to surprise them. Apparently, it often transforms into a silent child."
571,Zoroark,60,105,60,120,60,105,1.6,81.1,Bonds between these Pokémon are very strong. It protects the safety of its pack by tricking its opponents.
572,Minccino,55,50,40,40,40,75,0.4,5.8,"They greet one another by rubbing each other with their tails, which are always kept well groomed and clean."
573,Cinccino,75,95,60,65,60,115,0.5,7.5,Their white fur is coated in a special oil that makes it easy for them to deflect attacks.
574,Gothita,45,30,50,55,65,45,0.4,5.8,Their ribbonlike feelers increase their psychic power. They are always staring at something.
575,Gothorita,60,45,70,75,85,55,0.7,18.0,They use hypnosis to control people and Pokémon. Tales of Gothorita leading people astray are told in every corner.
576,Gothitelle,70,55,95,95,110,65,1.5,44.0,Starry skies thousands of light-years away are visible in the space distorted by their intense psychic power.
577,Solosis,45,30,40,105,50,20,0.3,1.0,They drive away attackers by unleashing psychic power. They can use telepathy to talk with others.
578,Duosion,65,40,50,125,60,30,0.6,8.0,"Since they have two divided brains, at times they suddenly try to take two different actions at once."
579,Reuniclus,110,65,75,125,85,30,1.0,20.1,"When Reuniclus shake hands, a network forms between their brains, increasing their psychic power."
580,Ducklett,62,44,50,44,50,55,0.5,5.5,These bird Pokémon are excellent divers. They swim around in the water eating their favorite food--peat moss.
581,Swanna,75,87,63,87,63,98,1.3,24.2,Swanna start to dance at dusk. The one dancing in the middle is the leader of the flock.
582,Vanillite,36,50,50,65,60,44,0.4,5.7,The temperature of their breath is -58° F. They create snow crystals and make snow fall in the areas around them.
583,Vanillish,51,65,65,80,75,59,1.1,41.0,"Snowy mountains are this Pokémon’s habitat. During an ancient ice age, they moved to southern areas."
584,Vanilluxe,71,95,85,110,95,79,1.3,57.5,"Swallowing large amounts of water, they make snow clouds inside their bodies and attack their foes with violent blizzards."
585,Deerling,60,60,50,40,50,75,0.6,19.5,"The color and scent of their fur changes to match the mountain grass. When they sense hostility, they hide in the grass."
586,Sawsbuck,80,100,70,60,70,95,1.9,92.5,They migrate according to the seasons. People can tell the season by looking at Sawsbuck’s horns.
587,Emolga,55,75,60,75,60,103,0.4,5.0,The energy made in its cheeks’ electric pouches is stored inside its membrane and released while it is gliding.
588,Karrablast,50,75,45,40,45,60,0.5,5.9,These mysterious Pokémon evolve when they receive electrical stimulation while they are in the same place as Shelmet.
589,Escavalier,70,135,105,60,105,20,1.0,33.0,"They fly around at high speed, striking with their pointed spears. Even when in trouble, they face opponents bravely."
590,Foongus,69,55,45,55,55,15,0.2,1.0,"It lures people in with its Poké Ball pattern, then releases poison spores. Why it resembles a Poké Ball is unknown."
591,Amoonguss,114,85,70,85,80,30,0.6,10.5,"It lures prey close by dancing and waving its arm caps, which resemble Poké Balls, in a swaying motion."
592,Frillish,55,40,50,65,85,40,1.2,33.0,"With its thin, veil-like arms wrapped around the body of its opponent, it sinks to the ocean floor."
593,Jellicent,100,60,70,85,105,60,2.2,135.0,"The fate of the ships and crew that wander into Jellicent’s habitat: all sunken, all lost, all vanished."
594,Alomomola,165,75,80,40,45,65,1.2,31.6,The special membrane enveloping Alomomola has the ability to heal wounds.
595,Joltik,50,47,50,57,50,65,0.1,0.6,Joltik that live in cities have learned a technique for sucking electricity from the outlets in houses.
596,Galvantula,70,77,60,97,60,108,0.8,14.3,"When attacked, they create an electric barrier by spitting out many electrically charged threads."
597,Ferroseed,44,50,91,24,86,10,0.6,18.8,"When threatened, it attacks by shooting a barrage of spikes, which gives it a chance to escape by rolling away."
598,Ferrothorn,74,94,131,54,116,20,1.0,110.0,It fights by swinging around its three spiky feelers. A hit from these steel spikes can reduce a boulder to rubble.
599,Klink,40,55,70,45,60,30,0.3,21.0,The two minigears that mesh together are predetermined. Each will rebound from other minigears without meshing.
600,Klang,60,80,95,70,85,50,0.6,51.0,"By changing the direction in which it rotates, it communicates its feelings to others. When angry, it rotates faster."
601,Klinklang,60,100,115,70,85,90,0.6,81.0,The gear with the red core is rotated at high speed for a rapid energy charge.
602,Tynamo,35,55,40,45,40,60,0.2,0.3,"While one alone doesn’t have much power, a chain of many Tynamo can be as powerful as lightning."
603,Eelektrik,65,85,70,75,70,40,1.2,22.0,They coil around foes and shock them with electricity-generating organs that seem simply to be circular patterns.
604,Eelektross,85,115,80,105,80,50,2.1,80.5,They crawl out of the ocean using their arms. They will attack prey on shore and immediately drag it into the ocean.
605,Elgyem,55,55,55,85,55,30,0.5,9.0,"It uses its strong psychic power to squeeze its opponent’s brain, causing unendurable headaches."
606,Beheeyem,75,75,75,125,95,40,1.0,34.5,"It can manipulate an opponent’s memory. Apparently, it communicates by flashing its three different-colored fingers."
607,Litwick,50,30,55,65,55,20,0.3,3.1,"Litwick shines a light that absorbs the life energy of people and Pokémon, which becomes the fuel that it burns."
608,Lampent,60,40,60,95,60,55,0.6,13.0,"This ominous Pokémon is feared. Through cities it wanders, searching for the spirits of the fallen."
609,Chandelure,60,55,90,145,90,80,1.0,34.3,"It absorbs a spirit, which it then burns. By waving the flames on its arms, it puts its foes into a hypnotic trance."
610,Axew,46,87,60,30,40,57,0.6,18.0,They use their tusks to crush the berries they eat. Repeated regrowth makes their tusks strong and sharp.
611,Fraxure,66,117,70,40,50,67,1.0,36.0,"Since a broken tusk will not grow back, they diligently sharpen their tusks on river rocks after they’ve been fighting."
612,Haxorus,76,147,90,60,70,97,1.8,105.5,They are kind but can be relentless when defending territory. They challenge foes with tusks that can cut steel.
613,Cubchoo,55,70,40,60,40,40,0.5,8.5,"When it is not feeling well, its mucus gets watery and the power of its Ice-type moves decreases."
614,Beartic,95,130,80,70,80,50,2.6,260.0,"It can make its breath freeze at will. Very able in the water, it swims around in northern seas and catches prey."
615,Cryogonal,80,50,50,95,135,105,1.1,148.0,"When its body temperature goes up, it turns into steam and vanishes. When its temperature lowers, it returns to ice."
616,Shelmet,50,40,85,40,65,25,0.4,7.7,"When attacked, it defends itself by closing the lid of its shell. It can spit a sticky, poisonous liquid."
617,Accelgor,80,70,40,100,60,145,0.8,25.3,"When its body dries out, it weakens. So, to prevent dehydration, it wraps itself in many layers of thin membrane."
618,Stunfisk,109,66,84,81,99,32,0.7,11.0,"Its skin is very hard, so it is unhurt even if stepped on by sumo wrestlers. It smiles when transmitting electricity."
619,Mienfoo,45,85,50,55,50,65,0.9,20.0,"In fights, they dominate with onslaughts of flowing, continuous attacks. With their sharp claws, they cut enemies."
620,Mienshao,65,125,60,95,60,105,1.4,35.5,It wields the fur on its arms like a whip. Its arm attacks come with such rapidity that they cannot even be seen.
621,Druddigon,77,120,90,60,90,48,1.6,139.0,"It warms its body by absorbing sunlight with its wings. When its body temperature falls, it can no longer move."
622,Golett,59,74,50,35,50,35,1.0,92.0,"The energy that burns inside it enables it to move, but no one has yet been able to identify this energy."
623,Golurk,89,124,80,55,80,55,2.8,330.0,It flies across the sky at Mach speeds. Removing the seal on its chest makes its internal energy go out of control.
624,Pawniard,45,85,70,40,40,60,0.5,10.2,"Blades comprise this Pokémon’s entire body. If battling dulls the blades, it sharpens them on stones by the river."
625,Bisharp,65,125,100,60,70,70,1.6,70.0,"It leads a group of Pawniard. It battles to become the boss, but will be driven from the group if it loses."
626,Bouffalant,95,110,95,40,95,55,1.6,94.6,"Their fluffy fur absorbs damage, even if they strike foes with a fierce headbutt."
627,Rufflet,70,83,50,37,50,60,0.5,10.5,"They crush berries with their talons. They bravely stand up to any opponent, no matter how strong it is."
628,Braviary,100,123,75,57,75,80,1.5,41.0,They fight for their friends without any thought about danger to themselves. One can carry a car while flying.
629,Vullaby,70,55,75,45,65,60,0.5,9.0,Their wings are too tiny to allow them to fly. They guard their posteriors with bones that were gathered by Mandibuzz.
630,Mandibuzz,110,65,105,55,95,80,1.2,39.5,It makes a nest out of bones it finds. It grabs weakened prey in its talons and hauls it to its nest of bones.
631,Heatmor,85,97,66,105,66,65,1.4,58.0,It breathes through a hole in its tail while it burns with an internal fire. Durant is its prey.
632,Durant,58,109,112,48,48,109,0.3,33.0,"They attack in groups, covering themselves in steel armor to protect themselves from Heatmor."
633,Deino,52,65,50,45,50,38,0.8,17.3,"It tends to bite everything, and it is not a picky eater. Approaching it carelessly is dangerous."
634,Zweilous,72,85,70,65,70,58,1.4,50.0,"After it has eaten up all the food in its territory, it moves to another area. Its two heads do not get along."
635,Hydreigon,92,105,90,125,90,98,1.8,160.0,"This brutal Pokémon travels the skies on its six wings. Anything that moves seems like a foe to it, triggering its attack."
636,Larvesta,55,85,55,50,55,60,1.1,28.8,"This Pokémon was believed to have been born from the sun. When it evolves, its entire body is engulfed in flames."
637,Volcarona,85,60,65,135,105,100,1.6,46.0,"When volcanic ash darkened the atmosphere, it is said that Volcarona’s fire provided a replacement for the sun."
638,Cobalion,91,90,129,90,72,108,2.1,250.0,This legendary Pokémon battled against humans to protect Pokémon. Its personality is calm and composed.
639,Terrakion,91,129,90,72,90,108,1.9,260.0,This Pokémon came to the defense of Pokémon that had lost their homes in a war among humans.
640,Virizion,91,90,72,90,129,108,2.0,200.0,This Pokémon fought humans in order to protect its friends. Legends about it continue to be passed down.
641,Tornadus,79,115,70,125,80,111,1.5,63.0,The lower half of its body is wrapped in a cloud of energy. It zooms through the sky at 200 mph.
642,Thundurus,79,115,70,125,80,111,1.5,61.0,Countless charred remains mar the landscape of places through which Thundurus has passed.
643,Reshiram,100,120,100,150,120,90,3.2,330.0,"This Pokémon appears in legends. It sends flames into the air from its tail, burning up everything around it."
644,Zekrom,100,150,120,120,100,90,2.9,345.0,"Concealing itself in lightning clouds, it flies throughout the Unova region. It creates electricity in its tail."
645,Landorus,89,125,90,115,80,101,1.5,68.0,Lands visited by Landorus grant such bountiful crops that it has been hailed as “The Guardian of the Fields.”
646,Kyurem,125,130,90,130,90,95,3.0,325.0,"It generates a powerful, freezing energy inside itself, but its body became frozen when the energy leaked out."
647,Keldeo,91,72,90,129,90,108,1.4,48.5,"By blasting water from its hooves, it can glide across water. It excels at using leg moves while battling."
648,Meloetta,100,77,77,128,128,90,0.6,6.5,Its melodies are sung with a special vocalization method that can control the feelings of those who hear it.
649,Genesect,71,120,95,120,95,99,1.5,82.5,"Over 300 million years ago, it was feared as the strongest of hunters. It has been modified by Team Plasma."
650,Chespin,56,61,65,48,45,38,0.4,9.0,"The quills on its head are usually soft. When it flexes them, the points become so hard and sharp that they can pierce rock."
651,Quilladin,61,78,95,56,58,57,0.7,29.0,It relies on its sturdy shell to deflect predators’ attacks. It counterattacks with its sharp quills.
652,Chesnaught,88,107,122,74,75,64,1.6,90.0,Its Tackle is forceful enough to flip a 50-ton tank. It shields its allies from danger with its own body.
653,Fennekin,40,45,40,62,60,60,0.4,9.4,"Eating a twig fills it with energy, and its roomy ears give vent to air hotter than 390 degrees Fahrenheit."
654,Braixen,59,59,58,90,70,73,1.0,14.5,"It has a twig stuck in its tail. With friction from its tail fur, it sets the twig on fire and launches into battle."
655,Delphox,75,69,72,114,100,104,1.5,39.0,"It gazes into the flame at the tip of its branch to achieve a focused state, which allows it to see into the future."
656,Froakie,41,56,40,62,44,71,0.3,7.0,It secretes flexible bubbles from its chest and back. The bubbles reduce the damage it would otherwise take when attacked.
657,Frogadier,54,63,52,83,56,97,0.6,10.9,"It can throw bubble-covered pebbles with precise control, hitting empty cans up to a hundred feet away."
658,Greninja,72,95,67,103,71,122,1.5,40.0,"It creates throwing stars out of compressed water. When it spins them and throws them at high speed, these stars can split metal in two."
659,Bunnelby,38,36,38,32,36,57,0.4,5.0,They use their large ears to dig burrows. They will dig the whole night through.
660,Diggersby,85,56,77,50,77,78,1.0,42.4,"With their powerful ears, they can heft boulders of a ton or more with ease. They can be a big help at construction sites."
661,Fletchling,45,50,43,40,38,62,0.3,1.7,These friendly Pokémon send signals to one another with beautiful chirps and tail-feather movements.
662,Fletchinder,62,73,55,56,52,84,0.7,16.0,"From its beak, it expels embers that set the tall grass on fire. Then it pounces on the bewildered prey that pop out of the grass."
663,Talonflame,78,81,71,74,69,126,1.2,24.5,"In the fever of an exciting battle, it showers embers from the gaps between its feathers and takes to the air."
